<?xml version="1.0" encoding="UTF-8"?>
<suren:autotest xmlns:suren="http://surenpi.com"
	xmlns:xsi="http://www.w3.org/2001/XMLSchema-instance"
	xsi:schemaLocation="http://surenpi.com http://surenpi.com/schema/autotest/autotest.web.framework.xsd ">
	<suren:engine driver="chrome" />
	<suren:pages pagePackage="autotest.demo.oschina.page">
		<suren:page class="GitHomePage" url="https://git.oschina.net/">
			<suren:field name="loginBut" type="button" strategy="zone">
				<suren:locators>
					<suren:locator name="byId" value="git-nav-user-bar"/>
					<suren:locator name="byPartialLinkText" value="登录"/>
				</suren:locators>
			</suren:field>
		</suren:page>
		
		<suren:page class="GitLoginPage" dataSource="login_data">
			<suren:field name="userName" type="input" byId="user_login" />
			<suren:field name="password" type="input" byId="user_password" />
		</suren:page>
		
		<suren:page class="GitUserHomePage" dataSource="user_home_data">
			<suren:field name="search" type="input" byId="search_top-search-input"></suren:field>
		</suren:page>
	</suren:pages>
	
	<suren:dataSources>
		<suren:dataSource name="login_data" type="xml_data_source" resource="login_data.xml"/>
		<suren:dataSource name="user_home_data" type="xml_data_source" resource="user_home_data.xml"/>
	</suren:dataSources>
</suren:autotest>
